{
  "decision": "PASS",
  "languages": {
    "python": 5396,
    "go": 35,
    "elixir": 205,
    "rust": 1,
    "javascript_typescript": 2
  },
  "layers": {
    "L0_supervisor": false,
    "L1_gateway": true,
    "L2_brain": false
  },
  "first_party_files": [
    "test_ipc.py",
    "test_kuzu.py",
    "test_usecases.py",
    "verify_spec30_fix.py",
    "scratch_test_mcp.py",
    ".aiwg/cache/old_evaluator.py",
    ".aiwg/obsidian_vault/Dummie Vault/.obsidian/plugins/obsidian-local-rest-api/main.js",
    ".aiwg/venv_ssh/lib/python3.12/site-packages/jsonref.py",
    ".aiwg/venv_ssh/lib/python3.12/site-packages/proxytypes.py",
    ".aiwg/venv_ssh/lib/python3.12/site-packages/typing_extensions.py",
    ".aiwg/venv_ssh/lib/python3.12/site-packages/aiofile/aio.py",
    ".aiwg/venv_ssh/lib/python3.12/site-packages/aiofile/utils.py",
    ".aiwg/venv_ssh/lib/python3.12/site-packages/aiofile/version.py",
    ".aiwg/venv_ssh/lib/python3.12/site-packages/aiofile/__init__.py",
    ".aiwg/venv_ssh/lib/python3.12/site-packages/annotated_types/test_cases.py",
    ".aiwg/venv_ssh/lib/python3.12/site-packages/annotated_types/__init__.py",
    ".aiwg/venv_ssh/lib/python3.12/site-packages/anyio/from_thread.py",
    ".aiwg/venv_ssh/lib/python3.12/site-packages/anyio/functools.py",
    ".aiwg/venv_ssh/lib/python3.12/site-packages/anyio/lowlevel.py",
    ".aiwg/venv_ssh/lib/python3.12/site-packages/anyio/pytest_plugin.py",
    ".aiwg/venv_ssh/lib/python3.12/site-packages/anyio/to_interpreter.py",
    ".aiwg/venv_ssh/lib/python3.12/site-packages/anyio/to_process.py",
    ".aiwg/venv_ssh/lib/python3.12/site-packages/anyio/to_thread.py",
    ".aiwg/venv_ssh/lib/python3.12/site-packages/anyio/__init__.py",
    ".aiwg/venv_ssh/lib/python3.12/site-packages/anyio/abc/_eventloop.py",
    ".aiwg/venv_ssh/lib/python3.12/site-packages/anyio/abc/_resources.py",
    ".aiwg/venv_ssh/lib/python3.12/site-packages/anyio/abc/_sockets.py",
    ".aiwg/venv_ssh/lib/python3.12/site-packages/anyio/abc/_streams.py",
    ".aiwg/venv_ssh/lib/python3.12/site-packages/anyio/abc/_subprocesses.py",
    ".aiwg/venv_ssh/lib/python3.12/site-packages/anyio/abc/_tasks.py",
    ".aiwg/venv_ssh/lib/python3.12/site-packages/anyio/abc/_testing.py",
    ".aiwg/venv_ssh/lib/python3.12/site-packages/anyio/abc/__init__.py",
    ".aiwg/venv_ssh/lib/python3.12/site-packages/anyio/streams/buffered.py",
    ".aiwg/venv_ssh/lib/python3.12/site-packages/anyio/streams/file.py",
    ".aiwg/venv_ssh/lib/python3.12/site-packages/anyio/streams/memory.py",
    ".aiwg/venv_ssh/lib/python3.12/site-packages/anyio/streams/stapled.py",
    ".aiwg/venv_ssh/lib/python3.12/site-packages/anyio/streams/text.py",
    ".aiwg/venv_ssh/lib/python3.12/site-packages/anyio/streams/tls.py",
    ".aiwg/venv_ssh/lib/python3.12/site-packages/anyio/streams/__init__.py",
    ".aiwg/venv_ssh/lib/python3.12/site-packages/anyio/_backends/_asyncio.py",
    ".aiwg/venv_ssh/lib/python3.12/site-packages/anyio/_backends/_trio.py",
    ".aiwg/venv_ssh/lib/python3.12/site-packages/anyio/_backends/__init__.py",
    ".aiwg/venv_ssh/lib/python3.12/site-packages/anyio/_core/_asyncio_selector_thread.py",
    ".aiwg/venv_ssh/lib/python3.12/site-packages/anyio/_core/_contextmanagers.py",
    ".aiwg/venv_ssh/lib/python3.12/site-packages/anyio/_core/_eventloop.py",
    ".aiwg/venv_ssh/lib/python3.12/site-packages/anyio/_core/_exceptions.py",
    ".aiwg/venv_ssh/lib/python3.12/site-packages/anyio/_core/_fileio.py",
    ".aiwg/venv_ssh/lib/python3.12/site-packages/anyio/_core/_resources.py",
    ".aiwg/venv_ssh/lib/python3.12/site-packages/anyio/_core/_signals.py",
    ".aiwg/venv_ssh/lib/python3.12/site-packages/anyio/_core/_sockets.py"
  ],
  "dependency_exclusions": [
    "node_modules",
    "target",
    ".venv",
    "_build",
    ".git",
    "build",
    "dist",
    ".aiwg/workspaces"
  ],
  "build_exclusions": [
    "mix_compile",
    "cargo_build",
    "npm_run_build"
  ],
  "test_roots": [
    "layers/l2_brain/tests"
  ],
  "runtime_roles": [
    "cognitive_agent",
    "supervisor_daemon",
    "comms_gateway"
  ],
  "warnings": [],
  "evidence_refs": [
    "package.json"
  ]
}